{
  "id": "theme1",
  "title": "제주도 가볼만한 곳",
  "description": "제주도 여행 시 꼭 방문해야 할 대표적인 관광 명소들을 모았습니다.",
  "created": "2023-07-15",
  "modified": "2023-08-20",
  "color": "#4285F4",
  "categories": [
    {
      "name": "관광 유형",
      "values": ["관광지", "자연", "해변", "산", "동굴"]
    },
    {
      "name": "활동",
      "values": ["등산", "수영", "산책", "카약"]
    }
  ],
  "labels": [
    {
      "name": "가족",
      "description": "가족 여행객에게 적합한 장소",
      "color": "#4CAF50"
    },
    {
      "name": "국립공원",
      "description": "국립공원으로 지정된 장소",
      "color": "#8BC34A"
    },
    {
      "name": "백록담",
      "description": "한라산 정상에 위치한 화산 분화구",
      "color": "#9C27B0"
    },
    {
      "name": "계곡",
      "description": "계곡이 있는 장소",
      "color": "#03A9F4"
    },
    {
      "name": "카약",
      "description": "카약 체험이 가능한 장소",
      "color": "#00BCD4"
    },
    {
      "name": "관광지",
      "description": "일반적인 관광 명소",
      "icon": "mdi:map-marker",
      "color": "#FF5722"
    },
    {
      "name": "자연",
      "description": "자연 경관 및 자연 환경과 관련된 장소",
      "icon": "mdi:nature",
      "color": "#8BC34A"
    },
    {
      "name": "유네스코",
      "description": "유네스코 세계유산으로 등재된 장소",
      "icon": "mdi:earth",
      "color": "#2196F3"
    },
    {
      "name": "일출",
      "description": "일출 감상 명소",
      "icon": "mdi:weather-sunset-up",
      "color": "#FF9800"
    },
    {
      "name": "전망",
      "description": "경치를 감상할 수 있는 전망 포인트",
      "icon": "mdi:eye",
      "color": "#9C27B0"
    },
    {
      "name": "섬",
      "description": "제주도 주변의 작은 섬",
      "icon": "mdi:island",
      "color": "#00BCD4"
    },
    {
      "name": "해변",
      "description": "해변 및 바다와 관련된 장소",
      "icon": "mdi:beach",
      "color": "#03A9F4"
    },
    {
      "name": "산책",
      "description": "산책하기 좋은 장소",
      "icon": "mdi:walk",
      "color": "#4CAF50"
    },
    {
      "name": "수영",
      "description": "수영이 가능한 장소",
      "icon": "mdi:swim",
      "color": "#00BCD4"
    },
    {
      "name": "산",
      "description": "산과 관련된 장소",
      "icon": "mdi:mountain",
      "color": "#8BC34A"
    },
    {
      "name": "등산",
      "description": "등산 활동이 가능한 장소",
      "icon": "mdi:hiking",
      "color": "#795548"
    },
    {
      "name": "동굴",
      "description": "동굴이나 용암 동굴",
      "icon": "mdi:tunnel",
      "color": "#607D8B"
    }
  ],
  "places": [
    {
      "id": "place1",
      "title": "성산일출봉",
      "location": {
        "lat": 33.458031,
        "lng": 126.942520
      },
      "address": "제주특별자치도 서귀포시 성산읍 일출로 284-12",
      "description": "제주도의 대표적인 관광지로, 유네스코 세계자연유산으로 등재되었습니다. 일출 명소로 유명하며, 정상에 오르면 제주의 아름다운 해안선을 감상할 수 있습니다.",
      "urls": {
        "naver": "https://map.naver.com/p/entry/place/11491961",
        "kakao": "https://place.map.kakao.com/8413089"
      },
      "labels": ["관광지", "자연", "유네스코", "일출", "전망"]
    },
    {
      "id": "place2",
      "title": "우도",
      "location": {
        "lat": 33.5031,
        "lng": 126.9511
      },
      "address": "제주특별자치도 제주시 우도면",
      "description": "제주도 동쪽에 위치한 작은 섬으로, 성산일출봉에서 배를 타고 약 15분 거리에 있습니다. 아름다운 해변과 소가 누워있는 형상을 닮았다고 하여 우도(牛島)라 불립니다.",
      "urls": {
        "naver": "https://map.naver.com/p/entry/place/13491613",
        "kakao": "https://place.map.kakao.com/8413461"
      },
      "labels": ["관광지", "자연", "섬", "해변", "산책"]
    },
    {
      "id": "place3",
      "title": "협재해수욕장",
      "location": {
        "lat": 33.3941,
        "lng": 126.2392
      },
      "address": "제주특별자치도 제주시 한림읍 협재리 2497-1",
      "description": "제주 서쪽에 위치한 아름다운 해변으로, 에메랄드빛 바다와 백사장이 인상적입니다. 비양도를 바라볼 수 있어 경치가 좋으며, 수심이 얕아 가족 여행객에게 인기가 있습니다.",
      "urls": {
        "naver": "https://map.naver.com/p/entry/place/11491975",
        "kakao": "https://place.map.kakao.com/8413343"
      },
      "labels": ["해변", "수영", "자연", "관광지", "가족"]
    },
    {
      "id": "place6",
      "title": "한라산",
      "location": {
        "lat": 33.3617,
        "lng": 126.5292
      },
      "address": "제주특별자치도 제주시 오등동 산 182-1",
      "description": "제주도의 중앙에 위치한 대한민국에서 가장 높은 산(1,947m)으로, 다양한 등산로가 있어 많은 등산객이 찾습니다. 정상에는 백록담이라는 화산 분화구가 있습니다.",
      "urls": {
        "naver": "https://map.naver.com/p/entry/place/11491637",
        "kakao": "https://place.map.kakao.com/8413721"
      },
      "labels": ["산", "등산", "자연", "국립공원", "백록담"]
    },
    {
      "id": "place7",
      "title": "만장굴",
      "location": {
        "lat": 33.5287,
        "lng": 126.7708
      },
      "address": "제주특별자치도 제주시 구좌읍 만장굴길 182",
      "description": "세계에서 가장 긴 용암동굴 중 하나로, 총 길이가 약 13.4km입니다. 유네스코 세계자연유산으로 등재되었으며, 동굴 내부의 다양한 용암 구조물을 관찰할 수 있습니다.",
      "urls": {
        "naver": "https://map.naver.com/p/entry/place/11491952",
        "kakao": "https://place.map.kakao.com/8413090"
      },
      "labels": ["동굴", "유네스코", "자연", "관광지"]
    },
    {
      "id": "place8",
      "title": "쇠소깍",
      "location": {
        "lat": 33.2539,
        "lng": 126.6222
      },
      "address": "제주특별자치도 서귀포시 하효동 1565",
      "description": "서귀포시에 위치한 아름다운 계곡으로, 담수와 해수가 만나는 독특한 지형을 갖고 있습니다. 투명 카약을 타고 주변 경관을 즐길 수 있어 인기 있는 관광지입니다.",
      "urls": {
        "naver": "https://map.naver.com/p/entry/place/13493225",
        "kakao": "https://place.map.kakao.com/11074562"
      },
      "labels": ["계곡", "카약", "자연", "관광지"]
    }
  ]
} 